{
  "schema_version": "1.0",
  "run_id": "t3-synthetic-closed-loop-v1",
  "scenario_id": "t3-identity-response-synthetic",
  "tenant_id": "tenant-a",
  "seeds": [0, 1, 2, 3, 4, 5, 6, 7, 8, 9, 10, 11, 12, 13, 14, 15, 16, 17, 18, 19, 20, 21, 22, 23, 24, 25, 26, 27, 28, 29],
  "horizon_steps": 16,
  "t2_context_spec": "configs/active_defense/runs/t2_synthetic_context_hunting_v1.json",
  "potential_graph": "configs/active_defense/evaluator_only/t3_identity_response_potential_graph_v1.json",
  "logging_hygiene_profiles": "configs/active_defense/hygiene/logging_hygiene_profiles_v1.json",
  "response_duration_steps": 4,
  "response_policy_hash": "5534631fc7ef2e4264d83d3adef0ae1445eca9d2426882e780cca199686d96b3",
  "cost_profile": {"job_cost_units": 1, "triage_cost_units": 2, "false_response_cost_units": 5, "cti_asm_cost_units": 3},
  "modes": ["B0_internal_open", "B1_context_open", "B2_internal_closed", "B3_context_closed"]
}
